{
  "document_id": "combined_primary",
  "filename": "Combined files including President Messages.pdf",
  "source_tier": 1,
  "role": "primary_substance",
  "authority": "substantive",
  "page_count": 17,
  "boilerplate_lines": [],
  "extraction_warnings": [
    "Low-confidence extraction on page 17"
  ],
  "pages": [
    {
      "page_number": 1,
      "raw_text": "Arizona’s Rule of Law Day: Why It Matters, and Why It Starts With Us\n“If we don’t protect the Rule of Law, we cannot expect the law to protect us.”\nOn February 12, 2026, something quietly profound will happen in courthouses across\nArizona. From Flagstaff to Yuma, lawyers and judges will gather not to argue cases or issue\nrulings, but to reaffirm a shared civic commitment: the Rule of Law. In Tucson, the State\nBar of Arizona and the Arizona Supreme Court will host a special ceremony at the Pima\nCounty Superior Court from 4:00 to 5:00 p.m., featuring Chief Justice Ann Timmer of the\nArizona Supreme Court, Presiding Superior Court Judge Danelle Liwski, and University of\nArizona James E. Rogers College of Law Dean Jason Kreag.\nThe date itself is rich with meaning. February 12 marks Arizona’s Rule of Law Day. It also\ncoincides with the 250th birthday of the Declaration of Independence and the birthday of\nAbraham Lincoln—a president who understood, perhaps better than any other, that\ndemocracy survives only when laws, not passions or power, rule the day.\nThe phrase “Rule of Law” is often invoked, sometimes casually, but its meaning is neither\nvague nor abstract. The World Justice Project defines the Rule of Law through four core\nprinciples: accountability (that government officials and private actors alike are subject to\nthe law); just law (that laws are clear, publicized, stable, and protect fundamental rights);\nopen government (that laws are enacted and enforced transparently); and accessible,\nimpartial justice (that justice is delivered by competent, ethical, and independent decision-\nmakers). In short, no one is above the law, the rules are known in advance, and disputes\nare resolved fairly.\nIt is vitally important because if we don’t protect the Rule of Law, we cannot expect the\nlaw to protect us.\nThis framework is not a luxury of stable societies; it is the reason they remain stable. The\nRule of Law is what transforms disagreement into dialogue, conflict into process, and\npower into responsibility. Without it, rights become aspirations rather than guarantees, and\ndemocracy becomes a slogan rather than a system.",
      "cleaned_text": "Arizona's Rule of Law Day: Why It Matters, and Why It Starts With Us\n“If we don't protect the Rule of Law, we cannot expect the law to protect us.”\nOn February 12, 2026, something quietly profound will happen in courthouses across\nArizona. From Flagstaff to Yuma, lawyers and judges will gather not to argue cases or issue\nrulings, but to reaffirm a shared civic commitment: the Rule of Law. In Tucson, the State\nBar of Arizona and the Arizona Supreme Court will host a special ceremony at the Pima\nCounty Superior Court from 4:00 to 5:00 p.m., featuring Chief Justice Ann Timmer of the\nArizona Supreme Court, Presiding Superior Court Judge Danelle Liwski, and University of\nArizona James E. Rogers College of Law Dean Jason Kreag.\nThe date itself is rich with meaning. February 12 marks Arizona's Rule of Law Day. It also\ncoincides with the 250th birthday of the Declaration of Independence and the birthday of\nAbraham Lincoln-a president who understood, perhaps better than any other, that\ndemocracy survives only when laws, not passions or power, rule the day.\nThe phrase “Rule of Law” is often invoked, sometimes casually, but its meaning is neither\nvague nor abstract. The World Justice Project defines the Rule of Law through four core\nprinciples: accountability (that government officials and private actors alike are subject to\nthe law); just law (that laws are clear, publicized, stable, and protect fundamental rights);\nopen government (that laws are enacted and enforced transparently); and accessible,\nimpartial justice (that justice is delivered by competent, ethical, and independent decision-\nmakers). In short, no one is above the law, the rules are known in advance, and disputes\nare resolved fairly.\nIt is vitally important because if we don't protect the Rule of Law, we cannot expect the\nlaw to protect us.\nThis framework is not a luxury of stable societies; it is the reason they remain stable. The\nRule of Law is what transforms disagreement into dialogue, conflict into process, and\npower into responsibility. Without it, rights become aspirations rather than guarantees, and\ndemocracy becomes a slogan rather than a system.",
      "headings": [
        "Arizona's Rule of Law Day: Why It Matters, and Why It Starts With Us",
        "Arizona Supreme Court, Presiding Superior Court Judge Danelle Liwski, and University of",
        "Arizona James E. Rogers College of Law Dean Jason Kreag."
      ],
      "line_count": 27,
      "low_confidence": false,
      "ocr_repaired": false
    },
    {
      "page_number": 2,
      "raw_text": "Lawyers and judges occupy a unique position in this ecosystem. Lawyers swear an oath\nnot to clients alone, but to the Constitution and the laws of Arizona and the United States.\nJudges, in turn, are entrusted to apply those laws impartially, without fear or favor. This\nshared professional obligation makes lawyers especially well-suited to promote, defend,\nand protect the Rule of Law—not as a partisan cause, but as a civic one.\nThat is why, during the February 12 ceremony, lawyers across the state will retake their\noath. It is a symbolic act, but symbols matter. They remind us that the Rule of Law is not\nself-executing. It depends on people—judges who decide cases with integrity, lawyers who\nadvocate ethically, and citizens who respect lawful outcomes even when they disagree.\nArizona’s Rule of Law Day is not only for lawyers. It is an invitation to all Arizonans to\nrecommit to the idea that our democracy works best when we insist on fairness,\naccountability, and equal justice. Under the leadership of our courts and our legal\nprofession—and with the engagement of an informed and principled public—we can\nensure that the Rule of Law remains not just an ideal we celebrate once a year, but a\npractice we defend every day.\nTed Schmidt is managing partner of the Tucson law firm Schmidt, Sethi & Akmajian and\nimmediate past president of the State Bar of Arizona",
      "cleaned_text": "Lawyers and judges occupy a unique position in this ecosystem. Lawyers swear an oath\nnot to clients alone, but to the Constitution and the laws of Arizona and the United States.\nJudges, in turn, are entrusted to apply those laws impartially, without fear or favor. This\nshared professional obligation makes lawyers especially well-suited to promote, defend,\nand protect the Rule of Law-not as a partisan cause, but as a civic one.\nThat is why, during the February 12 ceremony, lawyers across the state will retake their\noath. It is a symbolic act, but symbols matter. They remind us that the Rule of Law is not\nself-executing. It depends on people-judges who decide cases with integrity, lawyers who\nadvocate ethically, and citizens who respect lawful outcomes even when they disagree.\nArizona's Rule of Law Day is not only for lawyers. It is an invitation to all Arizonans to\nrecommit to the idea that our democracy works best when we insist on fairness,\naccountability, and equal justice. Under the leadership of our courts and our legal\nprofession-and with the engagement of an informed and principled public-we can\nensure that the Rule of Law remains not just an ideal we celebrate once a year, but a\npractice we defend every day.\nTed Schmidt is managing partner of the Tucson law firm Schmidt, Sethi & Akmajian and\nimmediate past president of the State Bar of Arizona",
      "headings": [],
      "line_count": 17,
      "low_confidence": false,
      "ocr_repaired": false
    },
    {
      "page_number": 3,
      "raw_text": "• Why the Rule of Law is eternally important, especially in this day in age\nThe first thing we do, let’s kill all the lawyers.”\nHitler\nFranco\nStalin\n— William Shakespeare, Henry VI, Part 2, Act IV, Scene 2.\nIt ensures that no person is above the law and no person is beneath its protection. That\nprinciple is the backbone of constitutional democracy.\nIt replaces power with principle. Disputes are resolved by neutral courts applying known\nrules—not by force, status, wealth, or politics.\nIt protects individual liberty. Property rights, free speech, due process, and equal\nprotection exist only where law restrains arbitrary authority.\nIt creates stability and predictability. Families, businesses, and communities can plan,\ninvest, and thrive when rules are transparent and consistently applied.\nIt preserves peaceful self-government. In polarized times, the Rule of Law is what allows\ndisagreement without disorder.\nIt is fragile. History shows that democracies erode not all at once, but gradually—when\nrespect for institutions and lawful process weakens.",